{
  "$schema": "./model-manifest.schema.json",
  "id": "pp-ocrv6-tiny-det",
  "label": "PP-OCRv6 Tiny Detector",
  "kind": "detector",
  "version": "tiny-2ba1506c0380",
  "source": "https://huggingface.co/PaddlePaddle/PP-OCRv6_tiny_det_onnx/tree/2ba1506c0380b8f0b03dd142459aac66d4421f6c",
  "license": "Apache-2.0",
  "artifact": "pp-ocrv6-tiny-det.onnx",
  "size_bytes": 1780590,
  "sha256": "193bab7a04fca699a6c82e6abb5b81bdb28177f0abd4062552b04908dafb19f8",
  "output_contract": "db-probability-map-v1",
  "output_name": "fetch_name_0",
  "probability_threshold": 0.2,
  "box_score_threshold": 0.4,
  "unclip_ratio": 1.4,
  "maximum_candidates": 3000,
  "input": {
    "name": "x",
    "shape": [
      1,
      3,
      960,
      960
    ],
    "color_order": "BGR",
    "mean": [
      0.485,
      0.456,
      0.406
    ],
    "std": [
      0.229,
      0.224,
      0.225
    ]
  }
}
