{
  "$schema": "./model-manifest.schema.json",
  "id": "pp-ocrv6-medium-det",
  "label": "PP-OCRv6 Medium Detector",
  "kind": "detector",
  "version": "medium-61323801669c",
  "source": "https://huggingface.co/PaddlePaddle/PP-OCRv6_medium_det_onnx/tree/61323801669c338b7891481ec7bac61ce31b576a",
  "license": "Apache-2.0",
  "artifact": "pp-ocrv6-medium-det.onnx",
  "size_bytes": 62032837,
  "sha256": "eb13b44b25bb36f89528b68720af8a61d9cf381176107f465db1757b65d086e1",
  "output_contract": "db-probability-map-v1",
  "output_name": "fetch_name_0",
  "probability_threshold": 0.2,
  "box_score_threshold": 0.45,
  "unclip_ratio": 1.4,
  "maximum_candidates": 3000,
  "input": {
    "name": "x",
    "shape": [
      1,
      3,
      960,
      960
    ],
    "color_order": "BGR",
    "mean": [
      0.485,
      0.456,
      0.406
    ],
    "std": [
      0.229,
      0.224,
      0.225
    ]
  }
}
