{
  "$schema": "./model-manifest.schema.json",
  "id": "pp-ocrv6-medium-rec",
  "label": "PP-OCRv6 Medium Recognizer",
  "kind": "recognizer",
  "version": "medium-50c7eacafc52",
  "source": "https://huggingface.co/PaddlePaddle/PP-OCRv6_medium_rec_onnx/tree/50c7eacafc52fa7bcf4194e8cd08e46f8558504b",
  "license": "Apache-2.0",
  "artifact": "pp-ocrv6-medium-rec.onnx",
  "size_bytes": 76554979,
  "sha256": "9c09abf0957f7968c7586464b7397b84ad2387a0497a351af40e9acc71b673ba",
  "output_name": "fetch_name_0",
  "output_contract": "ctc-probabilities-v1",
  "characters_file": "pp-ocrv6-medium-rec-charset.txt",
  "characters_sha256": "b5f2bfe2bdd9448429e3e82b51c789775d9b42f2403d082b00662eb77e401c5d",
  "characters_count": 18708,
  "class_count": 18710,
  "input": {
    "name": "x",
    "shape": [
      1,
      3,
      48,
      640
    ],
    "color_order": "BGR",
    "mean": [
      0.5,
      0.5,
      0.5
    ],
    "std": [
      0.5,
      0.5,
      0.5
    ]
  }
}
