{
  "$schema": "./model-manifest.schema.json",
  "id": "pp-ocrv5-mobile-rec",
  "label": "PP-OCRv5 Mobile Recognizer (中 / 英 / 日)",
  "kind": "recognizer",
  "version": "multilingual-v5-ed152b8b495f",
  "source": "https://huggingface.co/PaddlePaddle/PP-OCRv5_mobile_rec_onnx/tree/ed152b8b495f84de93cda5709d768548a9127622",
  "license": "Apache-2.0",
  "artifact": "pp-ocrv5-mobile-rec.onnx",
  "size_bytes": 16534782,
  "sha256": "da72dc72ca4dc220df0dfde68c1dedc31c58d3e76a25871122e5056227d50092",
  "output_name": "fetch_name_0",
  "output_contract": "ctc-probabilities-v1",
  "characters_file": "pp-ocrv5-mobile-rec-charset.txt",
  "characters_sha256": "d1979e9f794c464c0d2e0b70a7fe14dd978e9dc644c0e71f14158cdf8342af1b",
  "characters_count": 18383,
  "class_count": 18385,
  "input": {
    "name": "x",
    "shape": [
      1,
      3,
      48,
      640
    ],
    "color_order": "BGR",
    "mean": [
      0.5,
      0.5,
      0.5
    ],
    "std": [
      0.5,
      0.5,
      0.5
    ]
  }
}
