{
  "$schema": "./model-manifest.schema.json",
  "id": "pp-ocrv6-tiny-rec",
  "label": "PP-OCRv6 Tiny Recognizer",
  "kind": "recognizer",
  "version": "tiny-2612ab37152a",
  "source": "https://huggingface.co/PaddlePaddle/PP-OCRv6_tiny_rec_onnx/tree/2612ab37152ae0a677521bae4e1e3d4fb4cf7c30",
  "license": "Apache-2.0",
  "artifact": "pp-ocrv6-tiny-rec.onnx",
  "size_bytes": 4462639,
  "sha256": "9ef676d6ed3c88256a2d92c640c44f25b0c40947e111b14b8be8f594091563e6",
  "output_name": "fetch_name_0",
  "output_contract": "ctc-probabilities-v1",
  "characters_file": "pp-ocrv6-tiny-rec-charset.txt",
  "characters_sha256": "c5cbe34ef40c29c4df07ed012bf96569cb69a2d2a01a07027e9f13cb832bd9cd",
  "characters_count": 6904,
  "class_count": 6906,
  "input": {
    "name": "x",
    "shape": [
      1,
      3,
      48,
      640
    ],
    "color_order": "BGR",
    "mean": [
      0.5,
      0.5,
      0.5
    ],
    "std": [
      0.5,
      0.5,
      0.5
    ]
  }
}
